ID,Length,Tweets,Date,Source,Likes,Retweets
1059842858797223937,140,"RT @realDonaldTrump: No matter what she says, Senator Claire McCaskill will always vote against us and the Great State of Missouri! Vote fo…",2018-11-06 16:20:03,Twitter for iPhone,0,20202
1059842759467646976,140,RT @realDonaldTrump: I need @claudiatenney of #NY22 to be re-elected in order to get our big plans moving. Her opponent would be a disaster…,2018-11-06 16:19:39,Twitter for iPhone,0,12894
1059842697387753477,140,RT @realDonaldTrump: REMEMBER FLORIDA: I have been President of the United States for almost two years. During that time Senator Bill Nelso…,2018-11-06 16:19:24,Twitter for iPhone,0,21248
1059842646741528577,140,RT @realDonaldTrump: Law Enforcement has been strongly notified to watch closely for any ILLEGAL VOTING which may take place in Tuesday’s E…,2018-11-06 16:19:12,Twitter for iPhone,0,35339
1059842549769220097,139,"RT @realDonaldTrump: “Bill Nelson is kind of an empty figure in Washington. You never hear his name, he’s never in debates on key issues -…",2018-11-06 16:18:49,Twitter for iPhone,0,15671
1059833982777544705,117,Congressman Peter King of New York is a hardworking gem. Loves his Country and his State. Get out and VOTE for Peter!,2018-11-06 15:44:46,Twitter for iPhone,39670,9316
1059827782434328582,140,"There is a rumor, put out by the Democrats, that Josh Hawley of Missouri left the Arena last night early. It is Fak… https://t.co/Ig11ZN0iH2",2018-11-06 15:20:08,Twitter for iPhone,91051,24694
1059695972907921408,140,"A fantastic evening in Cape Girardeau, Missouri. Josh @HawleyMO will be a tireless champion for YOU. He is great on… https://t.co/GqMKi6D1lF",2018-11-06 06:36:22,Twitter for iPhone,45006,11375
1059674931737300993,140,"A vote for Claire McCaskill is a vote for Schumer, Pelosi, Waters, and their socialist agenda. Claire voted IN FAVO… https://t.co/RbIgMiM0nz",2018-11-06 05:12:46,Twitter for iPhone,43036,12145
1059672354715041792,71,RT @IvankaTrump: Ohio✈️Indiana✈️Missouri 🇺🇸🇺🇸🇺🇸 https://t.co/Xn51CudZUt,2018-11-06 05:02:31,Twitter for iPhone,0,9614
1059671375881928704,140,"RT @DanScavino: .@TheLeeGreenwood singing GOD BLESS THE USA in Cape Girardeau, Missouri at @realDonaldTrump’s #MAGARally... https://t.co/Gl…",2018-11-06 04:58:38,Twitter for iPhone,0,10815
1059630186738737152,140,"You have been loyal and faithful to your Country, and now you have a President that is loyal and faithful to you. G… https://t.co/JWD7K5mwe1",2018-11-06 02:14:58,Twitter for iPhone,59631,18026
1059623256087506944,108,"On my way, see you soon Cape Girardeau, Missouri! #MAGARally https://t.co/0pWiwCHGbh https://t.co/XZdgktuTmL",2018-11-06 01:47:25,Twitter for iPhone,45483,10288
1059618041716228096,140,"Massive crowd inside and outside the Allen County War Memorial Coliseum in Fort Wayne, Indiana! Thank you for joini… https://t.co/rqy782NkUL",2018-11-06 01:26:42,Twitter for iPhone,58008,15182
1059612735271505920,139,There is only one way to stop this Democrat-Led assault on our sovereignty – you have to VOTE Republican TOMORROW!… https://t.co/CIjg0iG7o7,2018-11-06 01:05:37,Twitter for iPhone,41940,12294
1059611961539915776,140,"Thank you Indiana! A vote for Mike @Braun4Indiana is a vote to keep your jobs going up, your wages going up, and yo… https://t.co/tFF6rzl3PW",2018-11-06 01:02:32,Twitter for iPhone,36012,9254
1059573108464648198,137,"Just landed in Fort Wayne, Indiana for a #MAGARally at the Allen County War Memorial Coliseum. See everyone soon! https://t.co/0pWiwCHGbh",2018-11-05 22:28:09,Twitter for iPhone,38098,8694
1059561007520116741,140,Republicans have created the best economy in the HISTORY of our Country – and the hottest jobs market on planet ear… https://t.co/cp8ug9z85I,2018-11-05 21:40:04,Twitter for iPhone,43681,12790
1059557569818181632,140,Thank you Ohio! When you enter the voting booth tomorrow you will be making a simple choice. A vote for Republicans… https://t.co/tQRwV9W36n,2018-11-05 21:26:24,Twitter for iPhone,40445,10849
1059550850673229826,140,"Something’s happening America! Get out tomorrow and https://t.co/0pWiwCHGbh so together, we can KEEP MAKING AMERICA… https://t.co/9SXSgywVeQ",2018-11-05 20:59:42,Twitter for iPhone,56145,17476
1059505422430801920,140,"“Bill Nelson is kind of an empty figure in Washington. You never hear his name, he’s never in debates on key issues… https://t.co/8kRAKIGhiz",2018-11-05 17:59:12,Twitter for iPhone,59762,15671
1059493120172322816,140,"RT @EricTrump: Friends, 
We are on the one yard line and need everyone to VOTE Republican tomorrow! America is back! America is winning aga…",2018-11-05 17:10:18,Twitter for iPhone,0,14038
1059470847751131138,140,Law Enforcement has been strongly notified to watch closely for any ILLEGAL VOTING which may take place in Tuesday’… https://t.co/QbE9BAR7bx,2018-11-05 15:41:48,Twitter for iPhone,126878,35339
1059469158830796800,140,REMEMBER FLORIDA: I have been President of the United States for almost two years. During that time Senator Bill Ne… https://t.co/pJCF6k4O5u,2018-11-05 15:35:06,Twitter for iPhone,76576,21248
1059464880955277312,140,So funny to see the CNN Fake Suppression Polls and false rhetoric. Watch for real results Tuesday. We are lucky CNN… https://t.co/17t8JrGdsP,2018-11-05 15:18:06,Twitter for iPhone,102999,30343
1059460759179198470,140,I need @claudiatenney of #NY22 to be re-elected in order to get our big plans moving. Her opponent would be a disas… https://t.co/iW8bNKpAFa,2018-11-05 15:01:43,Twitter for iPhone,47036,12894
1059439426022137856,140,"No matter what she says, Senator Claire McCaskill will always vote against us and the Great State of Missouri! Vote… https://t.co/vte19xUXWH",2018-11-05 13:36:57,Twitter for iPhone,76360,20202
1059435440497934337,139,"If @AndrewGillum did the same job with Florida that he has done in Tallahassee as Mayor, the State will be a crime… https://t.co/4lRrgDmf0z",2018-11-05 13:21:07,Twitter for iPhone,59267,17930
1059433483423178752,140,".@DebbieStabenow voted against Tax Cuts, great Healthcare, Supreme Court Justices and all of the many things the pe… https://t.co/6QxqxzVjrU",2018-11-05 13:13:20,Twitter for iPhone,49384,14461
1059317426653933568,140,Dana Rohrabacher has been a great Congressman for his District and for the people of Cal. He works hard and is resp… https://t.co/QmH6BCmCSA,2018-11-05 05:32:10,Twitter for iPhone,54220,14747
1059310562771984390,140,"John James, running as a Republican for the Senate from Michigan, is a spectacular young star of the future. We sho… https://t.co/KjzgRyQVDz",2018-11-05 05:04:53,Twitter for iPhone,79454,22861
1059264061030969344,140,"In just 2 days, the people of Tennessee are going to elect @VoteMarsha Blackburn to the United States Senate to pro… https://t.co/kT0fpjxNXC",2018-11-05 02:00:06,Twitter for iPhone,48266,13299
1059258034474704897,110,"Thank you for joining us tonight in Tennessee, @TheLeeGreenwood. GOD BLESS THE U.S.A.! https://t.co/hfxi4Ct6Pv",2018-11-05 01:36:10,Twitter for iPhone,84239,22838
1059230569257680896,140,Great to be back in Tennessee. On our way to the McKenzie Arena in Chattanooga for a huge #MAGARally - see everyone… https://t.co/8G3Fh7IRd3,2018-11-04 23:47:01,Twitter for iPhone,52237,12107
1059220177169063941,140,"Thank you Macon, Georgia! Get out on Tuesday, November 6th and VOTE for @BrianKempGA as your next Governor to prote… https://t.co/s5GFglygrw",2018-11-04 23:05:44,Twitter for iPhone,51222,12990
1059174162965716992,139,"On my way to Macon, Georgia where the crowds are massive, for a 4pmE #MAGARally. Will be in Chattanooga, Tennessee… https://t.co/D5Mc8j59of",2018-11-04 20:02:53,Twitter for iPhone,51031,13099
1059152270342975489,116,WOW - Departing the White House shortly. See you soon Georgia! #MAGA https://t.co/Lk0SoU8pie https://t.co/Sn9D9o4fNZ,2018-11-04 18:35:54,Twitter for iPhone,58146,14959
1059114860305362944,140,"RT @realDonaldTrump: .@DannyTarkanian is a great guy and a team player. He will represent his District, State and Country at the highest le…",2018-11-04 16:07:14,Twitter for iPhone,0,13665
1059109162339180545,114,"RT @realDonaldTrump: Martha McSally is a great warrior, her opponent a Nancy Pelosi Wacko! https://t.co/QEUdPWDDud",2018-11-04 15:44:36,Twitter for iPhone,0,17561
1059108641251442689,140,RT @realDonaldTrump: In Florida there is a choice between a Harvard/Yale educated man named @RonDeSantisFL who has been a great Congressman…,2018-11-04 15:42:32,Twitter for iPhone,0,28240
1059108445398491137,58,RT @realDonaldTrump: So Revealing! https://t.co/wR0Z4694ei,2018-11-04 15:41:45,Twitter for iPhone,0,48448
1059108268180733952,140,RT @realDonaldTrump: .@Troy_Balderson is doing a great job as Congressman from Ohio. We need him in D.C. Vote for Troy - He has my total En…,2018-11-04 15:41:03,Twitter for iPhone,0,12848
1059108211087892480,140,RT @realDonaldTrump: Congressman @RodBlum of Iowa got a desperately needed Flood Wall for Cedar Rapids that was almost impossible to get. H…,2018-11-04 15:40:49,Twitter for iPhone,0,12989
1059108153307086849,140,"RT @realDonaldTrump: Congressman @DaveBratVA7th is a fighter who is doing a great job for Virginia and for our Country. Border, Military, V…",2018-11-04 15:40:35,Twitter for iPhone,0,12284
1059108107903733760,140,"RT @realDonaldTrump: .@Erik_Paulsen, @Jason2CD, 
@JimHagedornMN and @PeteStauber love our Country and the Great State of Minnesota. They ar…",2018-11-04 15:40:24,Twitter for iPhone,0,11351
1059107947480051712,81,RT @realDonaldTrump: Just out: Consumer Confidence hits highest level since 2000.,2018-11-04 15:39:46,Twitter for iPhone,0,21626
1059107908405944320,140,RT @realDonaldTrump: .@MikeDeWine will be a great Governor for the People of Ohio. He is an outstanding man who loves his State – and alway…,2018-11-04 15:39:37,Twitter for iPhone,0,12022
1059107873589026823,139,"RT @realDonaldTrump: ....Richard Cordray will let you down, just like he did when he destroyed the government agency that he ran. Clone of…",2018-11-04 15:39:28,Twitter for iPhone,0,10608
1059107799240790016,140,"RT @realDonaldTrump: Congressman @KevinYoder has fought hard for the People of Kansas. Highly respected, strong on Crime, the Border, Milit…",2018-11-04 15:39:11,Twitter for iPhone,0,13644
1059106069824397312,140,RT @realDonaldTrump: Yesterday in Pittsburgh I was really impressed with Congressman Keith Rothfus (far more so than any other local politi…,2018-11-04 15:32:18,Twitter for iPhone,0,13903
1059106013989736448,140,RT @realDonaldTrump: It is outrageous what the Democrats are doing to our Country. Vote Republican now! https://t.co/0pWiwCHGbh https://t.c…,2018-11-04 15:32:05,Twitter for iPhone,0,40019
1059105547390205952,140,"RT @realDonaldTrump: That’s because they treat me fairly!
“@FoxNews tops @CNN and @MSNBC combined in October cable news ratings” https://t.…",2018-11-04 15:30:14,Twitter for iPhone,0,18657
1059105309598384129,140,"RT @realDonaldTrump: .@WalkerStapleton will be an extraordinary Governor for the State of Colorado. He is strong, smart, and has been succe…",2018-11-04 15:29:17,Twitter for iPhone,0,11275
1059105163808595968,140,"RT @realDonaldTrump: Illegal immigration affects the lives of all Americans. Illegal Immigration hurts American workers, burdens American t…",2018-11-04 15:28:42,Twitter for iPhone,0,29879
1059105079817584641,122,"RT @realDonaldTrump: Together, we are Making America Safe and Great Again! https://t.co/0pWiwCHGbh https://t.co/rWl5aSpY3O",2018-11-04 15:28:22,Twitter for iPhone,0,22947
1059104932215906304,140,"RT @realDonaldTrump: I love you Missouri! Under Republican leadership, America is BOOMING, America is THRIVING, and America is WINNING - be…",2018-11-04 15:27:47,Twitter for iPhone,0,14433
1059104823096819717,140,"RT @realDonaldTrump: Wow! The U.S. added 250,000 Jobs in October - and this was despite the hurricanes. Unemployment at 3.7%. Wages UP! The…",2018-11-04 15:27:21,Twitter for iPhone,0,28308
1059104476613799937,140,"RT @realDonaldTrump: I need the people of West Virginia to send a message to Chuck Schumer, Maxine Waters, Nancy Pelosi and the Radical Dem…",2018-11-04 15:25:59,Twitter for iPhone,0,14419
1059104221172260865,140,"RT @realDonaldTrump: Scott Perry of Pennsylvania is fantastic. He is strong on the Border, Crime, the Military, our Vets and the Second Ame…",2018-11-04 15:24:58,Twitter for iPhone,0,14756
1059101889898430464,136,"New Fox Poll shows a “40% Approval Rating by African Americans for President Trump, a record for Republicans.” Thank you, a great honor!",2018-11-04 15:15:42,Twitter for iPhone,109447,26512
1058913612813791232,88,Unbelievable crowd in Florida tonight. Get out and VOTE! #MAGA🇺🇸 https://t.co/zpLkAko8If,2018-11-04 02:47:33,Twitter for iPhone,76825,19926
1058898124448677890,140,If you want to protect criminal aliens – VOTE DEMOCRAT. If you want to protect Law-Abiding Americans – VOTE REPUBLI… https://t.co/uBBspeV0YP,2018-11-04 01:46:00,Twitter for iPhone,54277,15535
1058896605527597056,140,".@DannyTarkanian is a great guy and a team player. He will represent his District, State and Country at the highest… https://t.co/KVIL8bfPDr",2018-11-04 01:39:58,Twitter for iPhone,53338,13665
1058893955084025856,140,"Another fantastic #MAGARally tonight in the Great State of Florida. In just 3 days, the People of Florida are going… https://t.co/ehgVlvptIj",2018-11-04 01:29:26,Twitter for iPhone,48639,13579
1058857627411718144,140,"Heading to Pensacola, Florida - will be there soon. Amazing lines of people wanting to get in - what a crowd! Is th… https://t.co/KlKYIRCvqN",2018-11-03 23:05:05,Twitter for iPhone,41845,9225
1058856438091710464,140,"Governor @DougDucey of Arizona is doing a great job. Doug is strong on Crime, the Border, and our Second Amendment.… https://t.co/WesGJubW6i",2018-11-03 23:00:22,Twitter for iPhone,39534,10185
1058829196062048257,140,"....Lake Okeechobee and all of the hurricane money were a passion for Rick Scott, who called endlessly on behalf of… https://t.co/PMWeq5qPuq",2018-11-03 21:12:07,Twitter for iPhone,46237,12073
1058829182275411979,140,"In all the time I’ve been President, almost two years, never once did Senator Bill Nelson call me to ask for help f… https://t.co/etmGtXhdmm",2018-11-03 21:12:03,Twitter for iPhone,61042,16122
1058827516427808768,140,Rumor has it that Senator Joe Donnelly of Indiana is paying for Facebook ads for his so-called opponent on the libe… https://t.co/C5w1QAVUro,2018-11-03 21:05:26,Twitter for iPhone,95319,26461
1058825551090237441,140,"Arizona is such a Great State but it needs Border Security which @MarthaMcSally will provide, and Krysten Sinema do… https://t.co/INyojsKiNW",2018-11-03 20:57:38,Twitter for iPhone,57416,16000
1058820790546821120,140,"If Chuck Schumer and Nancy Pelosi gain the majority, they will try to raise your taxes, restore job-killing regulat… https://t.co/Oz37oGMsT6",2018-11-03 20:38:43,Twitter for iPhone,57201,17888
1058781668151050240,137,Landing in Montana now - at least everybody admits that my lines and crowds are far bigger than Barack Obama’s... https://t.co/PCibGjS209,2018-11-03 18:03:15,Twitter for iPhone,72465,17336
1058762842629984256,140,"New York, get out and VOTE for @JohnFasoNy, a great and hardworking Congressman. We need John’s voice in D.C. His o… https://t.co/AGPHFv8TwH",2018-11-03 16:48:27,Twitter for iPhone,53519,14540
1058759312808558592,144,"RT @IvankaTrump: As the FIRST female Governor of Iowa, @IAGovernor cut taxes, balanced the budget (with a 127 m surplus!) &amp; fostered a pro-…",2018-11-03 16:34:25,Twitter for iPhone,0,10207
1058758825300365312,57,Get out and VOTE for @DeanHeller! https://t.co/4HEkpQL3oy,2018-11-03 16:32:29,Twitter for iPhone,42022,10693
1058715144442781696,140,"A vicious accuser of Justice Kavanaugh has just admitted that she was lying, her story was totally made up, or FAKE… https://t.co/rjonHjlJLe",2018-11-03 13:38:55,Twitter for iPhone,148244,45674
1058711461214724097,139,"Thank you to @PeteHegseth and @KatiePavlich for your nice, and very wise, statements on the Economy. You both really get it! @foxandfriends",2018-11-03 13:24:16,Twitter for iPhone,43895,9723
1058691406263451648,136,"Heading to Montana and Florida today! Everyone is excited about the Jobs Numbers - 250,000 new jobs in October. Also, wages rising. Wow!",2018-11-03 12:04:35,Twitter for iPhone,58679,13570
1058687674742120448,139,"Indiana Rally, and Coach Bobby Knight, were incredible last night. Packed House in Honor of Mike Braun for Senate.… https://t.co/l0SYAR1hIv",2018-11-03 11:49:45,Twitter for iPhone,58283,12850
1058673875372908544,139,"Congresswoman Maxine Waters was called the most Corrupt Member of Congress! @FoxNews If Dems win, she would be put… https://t.co/cbVJ0Wr249",2018-11-03 10:54:55,Twitter for iPhone,84236,25327
1058553398172237824,139,"Scott Perry of Pennsylvania is fantastic. He is strong on the Border, Crime, the Military, our Vets and the Second… https://t.co/UXSHNQ7aXU",2018-11-03 02:56:11,Twitter for iPhone,62242,14756
1058531139034451969,120,"Massive #MAGARally🇺🇸tonight in Indiana, thank you. Everyone get out and https://t.co/0pWiwCHGbh! https://t.co/5jVFO6SIsz",2018-11-03 01:27:44,Twitter for iPhone,46824,12096
1058521517821190146,140,Republicans believe our Country should be a Sanctuary for law-abiding Americans – not criminal aliens. And Republic… https://t.co/b2LWUsZd25,2018-11-03 00:49:30,Twitter for iPhone,50073,13068
1058519264771096576,139,"In just 4 days, the people of Indiana are going to send Mike @braun4indiana to the United States Senate, so we can… https://t.co/isLVjIAMps",2018-11-03 00:40:33,Twitter for iPhone,42449,11232
1058498592208494592,139,"I need the people of West Virginia to send a message to Chuck Schumer, Maxine Waters, Nancy Pelosi and the Radical… https://t.co/Pt5WaN2zv6",2018-11-02 23:18:24,Twitter for iPhone,49982,14419
1058491932937203717,99,"Just landed - will see everyone in Southport, Indiana shortly! #MAGARally🇺🇸 https://t.co/zmapQS70CG",2018-11-02 22:51:57,Twitter for iPhone,39658,8185
1058490401802371072,72,THANK YOU WEST VIRGINIA! https://t.co/0pWiwCHGbh https://t.co/KmrMAt4Cea,2018-11-02 22:45:52,Twitter for iPhone,46596,9739
1058482506037641216,48,"JOBS, JOBS, JOBS! #MAGA 
https://t.co/ZqPjsPUX0t",2018-11-02 22:14:29,Twitter for iPhone,57498,15259
1058477374872920064,129,"Fantastic #MAGARally🇺🇸in West Virginia, thank you. Everyone get out and VOTE for Patrick @MorriseyWV and… https://t.co/ULTwmDpsiR",2018-11-02 21:54:06,Twitter for iPhone,46276,11797
1058388700617498625,23,https://t.co/nk2vKvHuaL,2018-11-02 16:01:44,Twitter for iPhone,194766,63370
1058356796262412288,140,"Will be going to West Virginia and Indiana today, TWO RALLIES! Don’t tell anyone (big secret), but I will be bringi… https://t.co/mPkP2cwnjW",2018-11-02 13:54:58,Twitter for iPhone,83895,19413
1058354748578033664,139,"Wow! The U.S. added 250,000 Jobs in October - and this was despite the hurricanes. Unemployment at 3.7%. Wages UP!… https://t.co/L41hTpmFha",2018-11-02 13:46:49,Twitter for iPhone,114143,28308
1058187885042716672,140,"I love you Missouri! Under Republican leadership, America is BOOMING, America is THRIVING, and America is WINNING -… https://t.co/RzR374LhE9",2018-11-02 02:43:46,Twitter for iPhone,55866,14433
1058182740414226433,140,Beautiful evening at a #MAGARally with great American Patriots. Loyal citizens like you helped build this Country a… https://t.co/Q2HMXoj5IK,2018-11-02 02:23:20,Twitter for iPhone,62023,16900
1058128196317728768,101,"Together, we are Making America Safe and Great Again! https://t.co/0pWiwCHGbh https://t.co/rWl5aSpY3O",2018-11-01 22:46:35,Twitter for iPhone,81565,22947
1058119417278676992,135,"On my way to Columbia, Missouri for a #MAGARally. Look forward to seeing everyone soon! https://t.co/0pWiwCHGbh https://t.co/oD6v3E13bk",2018-11-01 22:11:42,Twitter for iPhone,40899,8340
1058100070158098433,140,"Illegal immigration affects the lives of all Americans. Illegal Immigration hurts American workers, burdens America… https://t.co/5Ckg3EDVTg",2018-11-01 20:54:49,Twitter for iPhone,94502,29879
1058065457851351040,140,"....His opponent, Jared Polis, is weak on crime and weak on borders – could never do the job. Get out and VOTE – Wa… https://t.co/2CiW2ssls5",2018-11-01 18:37:17,Twitter for iPhone,34050,8158
1058065450075086850,140,".@WalkerStapleton will be an extraordinary Governor for the State of Colorado. He is strong, smart, and has been su… https://t.co/qWlhNffo5n",2018-11-01 18:37:15,Twitter for iPhone,46584,11275
1058064549977473025,139,Thank you to Rick Breckenridge and congratulations to Matt Rosendale (@MattForMontana). This is very big - see you… https://t.co/A3VUDEkSc4,2018-11-01 18:33:41,Twitter for iPhone,34481,8475
1057997981922873344,139,"Just had a long and very good conversation with President Xi Jinping of China. We talked about many subjects, with… https://t.co/oCSlKlE2Ny",2018-11-01 14:09:10,Twitter for iPhone,91255,20546
1057838200658579456,80,RT @realDonaldTrump: #JOBSNOTMOBS! VOTE REPUBLICAN NOW!! https://t.co/wso9ZHIvyF,2018-11-01 03:34:15,Twitter for iPhone,0,27361
1057838169641639941,116,"RT @realDonaldTrump: Harry Reid, when he was sane, agreed with us on Birthright Citizenship! https://t.co/ypiE1QWKag",2018-11-01 03:34:07,Twitter for iPhone,0,25072
1057837892062666755,131,"That’s because they treat me fairly!
“@FoxNews tops @CNN and @MSNBC combined in October cable news ratings” https://t.co/QX56Pwlmj4",2018-11-01 03:33:01,Twitter for iPhone,73783,18657
1057810265436090368,139,Fantastic evening in Florida with great PATRIOTS at a beautiful #MAGARally. Get out and https://t.co/0pWiwCq4MH so… https://t.co/ptwCzsGPFx,2018-11-01 01:43:15,Twitter for iPhone,46989,12263
1057797701834813440,79,"THANK YOU FLORIDA! Get out and VOTE Republican! #MAGA🇺🇸
https://t.co/v3hpKOPBik",2018-11-01 00:53:19,Twitter for iPhone,57151,15844
1057728445386539008,130,It is outrageous what the Democrats are doing to our Country. Vote Republican now! https://t.co/0pWiwCHGbh https://t.co/2crea9HF7G,2018-10-31 20:18:07,Twitter for iPhone,94506,40019
1057715198684000258,59,#JOBSNOTMOBS! VOTE REPUBLICAN NOW!! https://t.co/wso9ZHIvyF,2018-10-31 19:25:29,Twitter for iPhone,74599,27361
1057714919766925314,140,Yesterday in Pittsburgh I was really impressed with Congressman Keith Rothfus (far more so than any other local pol… https://t.co/2Tvono1y0v,2018-10-31 19:24:22,Twitter for iPhone,60044,13903
1057683481793302528,95,"Harry Reid, when he was sane, agreed with us on Birthright Citizenship! https://t.co/ypiE1QWKag",2018-10-31 17:19:27,Twitter for iPhone,75062,25072
1057674390446448642,140,"Paul Ryan should be focusing on holding the Majority rather than giving his opinions on Birthright Citizenship, som… https://t.co/fWpqNevAGI",2018-10-31 16:43:19,Twitter for iPhone,119261,31101
1057655675080314880,86,Republicans will protect people with pre-existing conditions far better than the Dems!,2018-10-31 15:28:57,Twitter for iPhone,75959,19109
1057654684356395008,99,"“Donald Trump has made good on his promises, and it drives Democrats Crazy!” Brad Blakeman @FoxNews",2018-10-31 15:25:01,Twitter for iPhone,60438,14044
1057638285026254848,83,The World is using our laws to our detriment. They laugh at the Stupidity they see!,2018-10-31 14:19:51,Twitter for iPhone,72102,17459
1057637708296794114,139,"....Harry Reid was right in 1993, before he and the Democrats went insane and started with the Open Borders (which… https://t.co/JlXxWCIzXG",2018-10-31 14:17:34,Twitter for iPhone,65276,18302
1057624553478897665,140,"So-called Birthright Citizenship, which costs our Country billions of dollars and is very unfair to our citizens, w… https://t.co/TDGBLMUNAh",2018-10-31 13:25:17,Twitter for iPhone,101315,27188
1057620518751428608,140,Melania and I were treated very nicely yesterday in Pittsburgh. The Office of the President was shown great respect… https://t.co/oF3EH6QweS,2018-10-31 13:09:15,Twitter for iPhone,69756,17362
1057619304949133312,113,Stock Market up more than 400 points yesterday. Today looks to be another good one. Companies earnings are great!,2018-10-31 13:04:26,Twitter for iPhone,59155,12152
1057614564639019009,140,"Our military is being mobilized at the Southern Border. Many more troops coming. We will NOT let these Caravans, wh… https://t.co/tVJx5Jw5kQ",2018-10-31 12:45:36,Twitter for iPhone,124064,31764
1057612657665171457,140,The Caravans are made up of some very tough fighters and people. Fought back hard and viciously against Mexico at N… https://t.co/C7GzKpp3oH,2018-10-31 12:38:01,Twitter for iPhone,69929,18678
1057325873312026624,140,"Congressman @KevinYoder has fought hard for the People of Kansas. Highly respected, strong on Crime, the Border, Mi… https://t.co/GQ4nVuonIF",2018-10-30 17:38:27,Twitter for iPhone,52706,13644
1057325717162213378,139,"....Richard Cordray will let you down, just like he did when he destroyed the government agency that he ran. Clone… https://t.co/zHunWW4fH9",2018-10-30 17:37:49,Twitter for iPhone,40931,10608
1057325714721124355,136,.@MikeDeWine will be a great Governor for the People of Ohio. He is an outstanding man who loves his State – and always produces big....,2018-10-30 17:37:49,Twitter for iPhone,46823,12022
1057288679390097408,60,Just out: Consumer Confidence hits highest level since 2000.,2018-10-30 15:10:39,Twitter for iPhone,93851,21626
